,Product,Summary
194,Over The Air API,Create and manage Android device software updates.
195,Overview,"The Google Pay API enables fast, simple checkout on your website, and gives you convenient access to hundreds of millions of cards saved to Google Accounts worldwide. When a user clicks the Google Pay payment button, they see a payment sheet that"
196,PageSpeed Module,The PageSpeed modules are open-source server modules that optimize your site automatically.
197,Payments Reseller Subscription API,"The Payments Reseller Subscription API enables a wholesale business-to-business platform for Google subscription products (such as Stadia, Nest, Google One), where third parties could resell these products to their customers. This API is used to activate and manage the Google subscriptions."
198,People API,View and manage contacts and domain profiles.
199,Picker,Embed a Google Drive file manager widget in your web app.
200,Place Autocomplete,"The Places API is also available with the Java Client, Python Client, Go Client and Node.js Client for Google Maps Services. The Places API and the client libraries are for use in server applications. If you're building a client-side application,"
201,Place Details,"The Places API is also available with the Java Client, Python Client, Go Client and Node.js Client for Google Maps Services. The Places API and the client libraries are for use in server applications. If you're building a client-side application,"
202,Places Library,"The functions in the Places Library, Maps JavaScript API enable your application to search for places (defined in this API as establishments, geographic locations, or prominent points of interest) contained within a defined area, such as the bounds"
203,Product Locator - implementation guide,"Google Maps Platform is available for web (JS, TS), Android, and iOS, and also offers web services APIs for getting information about places, directions, and distances. The samples in this guide are written for one platform, but documentation links"
204,Programmable Search Engine,Programmable Search Engine lets you programmatically build and manage search engines for your site.
205,Promotions tab,Deliver more value for users in Gmail.
206,Protocol Buffers,"Protocol buffers are a language-neutral, platform-neutral extensible mechanism for serializing structured data."
207,Public Alerts,"Tools, instructions, and support for providers of emergency alert data."
208,Public NTP,"A free, global time service that you can use to synchronize to Google's atomic clocks."
209,Quick & Verified Sign-up solution,Let users sign up quickly and verify their address based on their current location.
210,RDAP API,Read-only public API that searches for information about domain names.
211,Realtime Transit,Format for exchanging realtime public transit information.
212,fastlane,An open source platform that lets you automate every aspect of the development and release process for your Android and iOS apps.
213,FlatBuffers,"FlatBuffers is an efficient cross platform serialization library for C++, C#, C, Go, Java, JavaScript, Lobster, Lua, TypeScript, PHP, Python, and Rust."
214,Flutter,"Craft high-quality native interfaces on iOS and Android with this open source, mobile UI framework."
215,Go (language),"Build simple, reliable, and efficient software with this open source programming language."
216,Google Fonts,"Robust catalog of open-source fonts and icons, makes it easy to integrate expressive type and icons seamlessly."
217,Kaggle,Kaggle is an online community of data scientists and machine learning practitioners.
218,Lit,"Lit is a simple library for building fast, lightweight web components."
219,Material Design,Material is a design system backed by open source code that helps teams build high-quality digital experiences.
220,On-Demand Rides and Deliveries,Power rides and deliveries with detailed geospatial data and predictable pricing.
221,Tables,Area 120 Tables API product.
222,reCAPTCHA,Protect your site from spam and abuse.
223,reCAPTCHA Enterprise,reCAPTCHA Enterprise protects your website from spam and abuse.
224,REST API,"The Google Fit REST API enables you to store and read health and wellness data in the fitness store from apps on any platform. The REST API provides resources and methods to: Create, obtain, list, and modify data sources. A data source represents a"
225,Runtime Configurator Fundamentals,"This document provides an overview of the Runtime Configurator feature and describes the key concepts related to Runtime Configurator. To learn how to create a RuntimeConfig resource, read Creating and Deleting RuntimeConfig Resources. The Runtime"
226,Safe Browsing APIs (v4),The Safe Browsing APIs allow client applications to check URLs against Google's constantly updated lists of unsafe web resources.
227,Search Central,Improve your site's visibility on Google Search
228,Security Command Center,The canonical security and data risk database for Google Cloud.
229,Service Infrastructure,"Service Infrastructure is a foundational platform for creating, managing, securing, and consuming APIs and services across organizations. It is used by Google APIs, Cloud APIs, Cloud Endpoints, and API Gateway. Service Infrastructure provides a wide"
230,Sheets API,"Send feedback Read and write spreadsheet data. Create charts and build pivot tables. The Google Sheets API lets you read, write, and format Google Sheets data with your preferred programming language, including Java, JavaScript, and Python. Get"
231,Sign In With Google,"User sign-up and sign-in featuring personalized buttons, one tap and automatic sign-in."
232,Sleep API,"Provides a simple, automatic mechanism for detecting sleep-related events."
233,Slides API,Integrate your service with Google Slides.
234,Smart Device Management API,"Access, control, and manage Google Nest devices programmatically."
235,Smart Lock for Passwords on Android,"Programmatically save and retrieve credentials, and automatically sign users in across devices and websites in Chrome."
236,SMS Verification APIs,Create great SMS verification experiences on Android.
237,Snapshot API overview,"You can use the Snapshot API to get information about the user's current environment. With the Snapshot API, you can access a variety of context signals: The system caches these values so that they can be returned quickly. If there's no data, sensing"
238,SPDY,Speed up the web using the SPDY networking protocol.
239,Spectrum Access System APIs,Manage your network resources that are controlled by Google's Spectrum Access System (SAS).
240,Static Transit,Format for exchanging static public transit information.
241,Street View,"Google Street View provides panoramic 360-degree views from designated roads throughout its coverage area. This video shows how you can use the Street View service to give your users a real-world experience of an address on the map, providing them"
242,Street View,"Google Maps Street View lets you explore places around the world through 360-degree, street-level imagery. You can explore world landmarks, view natural wonders, navigate a trip, or show the outside of your business. Google Street View provides"
243,Street View,APIs for contributing to Street View imagery.
244,Street View Publish API,Upload your own Street View.
245,Street View Service,Google Street View provides panoramic 360 degree views from designated roads throughout its coverage area. Street View's API coverage is the same as that for the Google Maps application ( https://maps.google.com/ ). The list of currently supported
246,Subscribe with Google,Optimize the subscription experience for your users.
247,Swiffy,A simple Flash to HTML5 converter that helps make SWF files available to a larger audience.
248,Tag Manager,"Deploy and update measurement tags on your websites and mobile apps from a web interface, without major code changes or app releases."
249,Tags,"Developer reference for Google's tag tools and libraries, including global site tags (gtag.js) and Google Tag Manager."
250,Tasks API,Integrate your service with Google Tasks.
251,Tau VMs with industry-leading performance,Compute Engine VM family optimized for cost-effective performance of scale-out workloads.
252,Things to do,Make it easy for users to search for things to do and seamlessly connect with partners.
253,Timeseries Insights API,"Provides a Timeseries Insights service which operates over time series data. Users can perform time series spike, trend, and anomaly detection. With a straightforward API and easy to understand results, the service makes it simple to gather insights from large amounts of time series data (e.g. monitoring datasets) and integrate these insights in their applications."
254,Tink,"Tink is a multi-language, cross-platform, open source library that provides secure and easy-to-use cryptographic APIs."
255,Tools for Web Developers,Discover tools that can help you kickstart your development.
256,Transit,Common formats for exchanging static and realtime public transit information.
257,Universal Analytics for Web (gtag.js),"A JavaScript tagging framework and API that lets you configure a site to send event data to Google Analytics, Google Ads, and Google Marketing Platform."
258,User Deletion API,Delete all data in a Google Analytics property associated with a user identifier.
259,User engagement,Bring users back to your Action
260,User engagement,Bring users back to your Action
261,User Location,Most browsers and devices have access to the user's geographic location. Learn how to work with the user's location in your site and apps.
262,Using OAuth 2.0 to Access Google APIs,"Google APIs use the OAuth 2.0 protocol for authentication and authorization. Google supports common OAuth 2.0 scenarios such as those for web server, client-side, installed, and limited-input device applications. To begin, obtain OAuth 2.0 client"
263,Using VPC Flow Logs,"VPC Flow Logs records a sample of network flows sent from and received by VM instances, including instances used as GKE nodes. These logs can be used for network monitoring, forensics, real-time security analysis, and expense optimization. This page"
264,Vault API,"Send feedback Perform eDiscovery tasks. Search, hold, and export data of interest. Use the Vault API for eDiscovery of your organization's data in supported Google Workspace services. Manage matters, place holds, and start and download exports. Get"
265,Voice Actions,Let users complete actions in your app using voice commands.
266,VPC Service Controls,Define a security perimeter around resources of Google managed services to control communication to and between those services.
267,Waze,Add navigation and traffic updates to your sites and apps with Waze features.
268,Waze Ads Management API,Create and manage Waze Ads accounts
269,Web,Build the next generation of web experiences.
270,Web Fundamentals,Google's opinionated reference for building amazing web experiences.
271,WebP,An image format for the Web.
272,WebRTC,An open framework for the web that enables Real-Time Communications (RTC) capabilities in the browser.
273,Workbox,Workbox is a set of service worker libraries that making build progressive web apps easy.
274,YouTube,Integrate YouTube videos and functionality into your website or application.
275,YouTube Analytics and Reporting APIs,Retrieve YouTube Analytics data for YouTube videos and channels.
276,YouTube Data API,Lets your application retrieve YouTube content while also enabling YouTube users to manage their YouTube accounts.
277,YouTube for Android,Add YouTube functionality to your Android apps.
278,YouTube Live Streaming API,"Create, update, and manage live events on YouTube."
279,YouTube Subscribe Button,Enable users to subscribe to your channel with one click.
